original,prediccion
habita en aguas poco profundas y rocosas,t ocat o a n s ia a e
opera principalmente vuelos de cabotaje y regionales de carga,cs la eo eo ecomo a e uap pre prsvos eur cpate o o s stra
para visitar contactar primero con la direccin,es e c fa r cncocis psorstcs pes isi as cela osps po op 
realiz los estudios primarios en francia para continuar luego en espa単a,uast ntaca ete pes ete le a e l 
en los a単os que siguieron este trabajo esparta produjo docenas de buenos jugadores,ds sociti ec enor easiat tgfa e toacntaseoraepos otena lte s soso 
se est tratando de recuperar su cultivo en las islas canarias,ost ptet en treapras nat ea t elia tfr s ts t qenlel etd
fue sacada de la serie en el episodio lead en que alexandra cabot regres,nt e n s ftate a e e e pec oc eg le ecs ps a es ecast e l pta
que va a hacer todo el mal para separar los dos,coelftscacnlelc cate ecader pero ca eue as rs gr prpe e
las lluvias y granizadas son muy frecuentes,ea l mad a e eoa e soe ot elaei ea enia
este asesinato suceda una noche sin luna y muy oscura,s ola ea s s soe dos ecsoacianoda p iname l a esetos cateo pa e
al morir tras seis a ocho meses de vida se le desprende la cabeza,tas p eou arc a sl efasts ec la eaces ecs cos as peiapas a e es ptp ptptp sta nk 
simplemente los enfrentamos,es ocua ein p e s e e jm
fue de origen belga,ta aseseia s a l stet to eo 
limita con la peque単a isla de rona sur por su costa norte,es n n aoca e nan o ha ectr sd eil cipa ente spetptod
produccin musical edwin arellano,t etetna tn rc cas scn e oe cecsreti ca en l a e pt et po 
dicha zona constituye el lindero este del municipio,ua p e atos at n ia c eci e e t a r e epso pta
posteriormente fernando fue hecho prisionero y sera mantenido en cautiverio durante seis a単os,s o as et o gi ad a egnasin evlda enobis eqel e s m
tuvo una slida formacin con orientacin neoclsica,s oas es esrbosdriaesa es s eos ad sa ea etmplaesa 
se desconoce el criterio de seleccin seguido por el recopilador,es sta at s li tr seste e e s a eia npcfas a e s eni a et sa p apse pe pe eat e etn pna
al principio formaron esta banda sin significados graves,t pt pe p pe rcuntrs ec co do etces ac oe e p pa 
